{
  "version": 1,
  "sceneId": "object.water-life.reeds-cattails",
  "rootNodeId": "root",
  "nodes": [
    {
      "id": "root",
      "name": "reeds-cattails",
      "type": "Node2D",
      "parentId": null,
      "order": 0,
      "properties": {
        "position": [
          0,
          0
        ]
      }
    },
    {
      "id": "visual",
      "name": "Visual",
      "type": "Sprite2D",
      "parentId": "root",
      "order": 0,
      "properties": {
        "texture": {
          "resourceId": "water-life.reeds-cattails.sprite"
        },
        "frame": 0,
        "origin": [
          0.5,
          1
        ],
        "scale": [
          0.62,
          0.62
        ],
        "visualOffset": [
          0,
          0
        ],
        "depthMode": "world-sorted",
        "depthBand": "world-entities"
      }
    },
    {
      "id": "ambient-animation",
      "name": "AmbientAnimation",
      "type": "AnimationPlayer",
      "parentId": "root",
      "order": 1,
      "properties": {
        "library": {
          "resourceId": "water-life.reeds-cattails.animations"
        },
        "domain": "render",
        "autoplay": "object.water-life.idle",
        "randomizeStart": true
      }
    }
  ],
  "instances": [],
  "subresources": [
    {
      "version": 1,
      "resourceId": "water-life.reeds-cattails.sprite",
      "kind": "sprite-sheet",
      "assetId": "sheet.water.reeds.8x4",
      "frameWidth": 128,
      "frameHeight": 128
    },
    {
      "version": 1,
      "resourceId": "water-life.reeds-cattails.animations",
      "kind": "animation-library",
      "animations": {
        "object.water-life.idle": {
          "durationSeconds": 2,
          "framesPerSecond": 4,
          "loop": true,
          "loopMode": "wrap",
          "tracks": [
            {
              "binding": "../Visual",
              "property": "frame",
              "keys": [
                {
                  "at": 0,
                  "value": 0
                },
                {
                  "at": 1,
                  "value": 1
                },
                {
                  "at": 2,
                  "value": 2
                },
                {
                  "at": 3,
                  "value": 3
                },
                {
                  "at": 4,
                  "value": 4
                },
                {
                  "at": 5,
                  "value": 5
                },
                {
                  "at": 6,
                  "value": 6
                },
                {
                  "at": 7,
                  "value": 7
                }
              ]
            }
          ]
        }
      }
    }
  ]
}
