{
  "version": 1,
  "sceneId": "object.interior-decor-sconce-side-unlit",
  "rootNodeId": "root",
  "nodes": [
    {
      "id": "root",
      "name": "sconce-side-unlit",
      "type": "Node2D",
      "parentId": null,
      "order": 0,
      "properties": {
        "position": [
          0,
          0
        ]
      }
    },
    {
      "id": "visual",
      "name": "Visual",
      "type": "Sprite2D",
      "parentId": "root",
      "order": 0,
      "properties": {
        "texture": {
          "resourceId": "interior-decor-sconce-side-unlit.sprite"
        },
        "frame": 14,
        "origin": [
          0.5,
          1
        ],
        "scale": [
          0.6,
          0.6
        ],
        "visualOffset": [
          0,
          0
        ],
        "depthMode": "world-sorted",
        "depthBand": "world-entities"
      }
    }
  ],
  "instances": [],
  "subresources": [
    {
      "version": 1,
      "resourceId": "interior-decor-sconce-side-unlit.sprite",
      "kind": "sprite-sheet",
      "assetId": "sheet.interiors.decor-lighting-utility.8x8",
      "frameWidth": 128,
      "frameHeight": 128
    }
  ]
}
