{
  "version": 1,
  "sceneId": "object.interior-storage-bookshelf-books-e",
  "rootNodeId": "body",
  "nodes": [
    {
      "id": "body",
      "name": "bookshelf-books-e",
      "type": "StaticBody2D",
      "parentId": null,
      "order": 0,
      "properties": {
        "collisionLayer": 1,
        "collisionMask": 0,
        "position": [
          0,
          0
        ]
      }
    },
    {
      "id": "body-shape",
      "name": "BodyShape",
      "type": "CollisionShape2D",
      "parentId": "body",
      "order": 0,
      "properties": {
        "shape": {
          "resourceId": "interior-storage-bookshelf-books-e.shape"
        },
        "position": [
          -0.4,
          -20.84
        ]
      }
    },
    {
      "id": "visual",
      "name": "Visual",
      "type": "Sprite2D",
      "parentId": "body",
      "order": 1,
      "properties": {
        "texture": {
          "resourceId": "interior-storage-bookshelf-books-e.sprite"
        },
        "frame": 41,
        "origin": [
          0.5,
          1
        ],
        "scale": [
          0.8,
          0.8
        ],
        "visualOffset": [
          0,
          0
        ],
        "depthMode": "world-sorted",
        "depthBand": "world-entities"
      }
    }
  ],
  "instances": [],
  "subresources": [
    {
      "version": 1,
      "resourceId": "interior-storage-bookshelf-books-e.sprite",
      "kind": "sprite-sheet",
      "assetId": "sheet.interiors.storage-states.8x8",
      "frameWidth": 128,
      "frameHeight": 128
    },
    {
      "version": 1,
      "resourceId": "interior-storage-bookshelf-books-e.shape",
      "kind": "collision-shape",
      "value": {
        "shape": "rectangle",
        "width": 41.536,
        "height": 35.28
      }
    }
  ]
}
