{
  "version": 1,
  "sceneId": "object.water-life.kelp-teal",
  "rootNodeId": "root",
  "nodes": [
    {
      "id": "root",
      "name": "kelp-teal",
      "type": "Node2D",
      "parentId": null,
      "order": 0,
      "properties": {
        "position": [
          0,
          0
        ]
      }
    },
    {
      "id": "visual",
      "name": "Visual",
      "type": "Sprite2D",
      "parentId": "root",
      "order": 0,
      "properties": {
        "texture": {
          "resourceId": "water-life.kelp-teal.sprite"
        },
        "frame": 24,
        "origin": [
          0.5,
          1
        ],
        "scale": [
          0.9,
          0.9
        ],
        "visualOffset": [
          0,
          0
        ],
        "alpha": 0.5,
        "tint": "#7ea4bf",
        "depthMode": "explicit",
        "depthBand": "ground-decals",
        "depth": 2000000000.6
      }
    },
    {
      "id": "ambient-animation",
      "name": "AmbientAnimation",
      "type": "AnimationPlayer",
      "parentId": "root",
      "order": 1,
      "properties": {
        "library": {
          "resourceId": "water-life.kelp-teal.animations"
        },
        "domain": "render",
        "autoplay": "object.water-life.idle",
        "randomizeStart": true
      }
    }
  ],
  "instances": [],
  "subresources": [
    {
      "version": 1,
      "resourceId": "water-life.kelp-teal.sprite",
      "kind": "sprite-sheet",
      "assetId": "sheet.water.plants.8x5",
      "frameWidth": 128,
      "frameHeight": 128
    },
    {
      "version": 1,
      "resourceId": "water-life.kelp-teal.animations",
      "kind": "animation-library",
      "animations": {
        "object.water-life.idle": {
          "durationSeconds": 2.6666666666666665,
          "framesPerSecond": 3,
          "loop": true,
          "loopMode": "wrap",
          "tracks": [
            {
              "binding": "../Visual",
              "property": "frame",
              "keys": [
                {
                  "at": 0,
                  "value": 24
                },
                {
                  "at": 1,
                  "value": 25
                },
                {
                  "at": 2,
                  "value": 26
                },
                {
                  "at": 3,
                  "value": 27
                },
                {
                  "at": 4,
                  "value": 28
                },
                {
                  "at": 5,
                  "value": 29
                },
                {
                  "at": 6,
                  "value": 30
                },
                {
                  "at": 7,
                  "value": 31
                }
              ]
            }
          ]
        }
      }
    }
  ]
}
