{
  "version": 1,
  "sceneId": "object.rock-world-wall-decorative.field-22",
  "rootNodeId": "root",
  "nodes": [
    {
      "id": "root",
      "name": "field-22",
      "type": "Node2D",
      "parentId": null,
      "order": 0,
      "properties": {
        "position": [
          0,
          0
        ]
      }
    },
    {
      "id": "visual",
      "name": "Visual",
      "type": "Sprite2D",
      "parentId": "root",
      "order": 0,
      "properties": {
        "texture": {
          "resourceId": "rock-world-wall-decorative.field-22.sprite"
        },
        "frame": 21,
        "origin": [
          0.5,
          1
        ],
        "scale": [
          1,
          1
        ],
        "visualOffset": [
          0,
          0
        ],
        "depthMode": "world-sorted",
        "depthBand": "world-entities"
      }
    }
  ],
  "instances": [],
  "subresources": [
    {
      "version": 1,
      "resourceId": "rock-world-wall-decorative.field-22.sprite",
      "kind": "sprite-sheet",
      "assetId": "sheet.rocks.8x3",
      "frameWidth": 96,
      "frameHeight": 96
    }
  ]
}
