{
  "version": 1,
  "sceneId": "object.interior-mushroom-large-alchemy-workbench",
  "rootNodeId": "body",
  "nodes": [
    {
      "id": "body",
      "name": "alchemy-workbench",
      "type": "StaticBody2D",
      "parentId": null,
      "order": 0,
      "properties": {
        "collisionLayer": 1,
        "collisionMask": 0,
        "position": [
          0,
          0
        ]
      }
    },
    {
      "id": "body-shape",
      "name": "BodyShape",
      "type": "CollisionShape2D",
      "parentId": "body",
      "order": 0,
      "properties": {
        "shape": {
          "resourceId": "interior-mushroom-large-alchemy-workbench.shape"
        },
        "position": [
          -0.41,
          -53.792
        ]
      }
    },
    {
      "id": "visual",
      "name": "Visual",
      "type": "Sprite2D",
      "parentId": "body",
      "order": 1,
      "properties": {
        "texture": {
          "resourceId": "interior-mushroom-large-alchemy-workbench.sprite"
        },
        "frame": 7,
        "origin": [
          0.5,
          1
        ],
        "scale": [
          0.82,
          0.82
        ],
        "visualOffset": [
          0,
          0
        ],
        "depthMode": "world-sorted",
        "depthBand": "world-entities"
      }
    }
  ],
  "instances": [],
  "subresources": [
    {
      "version": 1,
      "resourceId": "interior-mushroom-large-alchemy-workbench.sprite",
      "kind": "sprite-sheet",
      "assetId": "sheet.interiors.mushroom-large-furniture.4x4",
      "frameWidth": 256,
      "frameHeight": 256
    },
    {
      "version": 1,
      "resourceId": "interior-mushroom-large-alchemy-workbench.shape",
      "kind": "collision-shape",
      "value": {
        "shape": "rectangle",
        "width": 165.2464,
        "height": 101.024
      }
    }
  ]
}
