{
  "version": 1,
  "sceneId": "object.interior-mushroom-floor-stepping-stone-6",
  "rootNodeId": "root",
  "nodes": [
    {
      "id": "root",
      "name": "stepping-stone-6",
      "type": "Node2D",
      "parentId": null,
      "order": 0,
      "properties": {
        "position": [
          0,
          0
        ]
      }
    },
    {
      "id": "visual",
      "name": "Visual",
      "type": "Sprite2D",
      "parentId": "root",
      "order": 0,
      "properties": {
        "texture": {
          "resourceId": "interior-mushroom-floor-stepping-stone-6.sprite"
        },
        "frame": 5,
        "origin": [
          0.5,
          1
        ],
        "scale": [
          0.6,
          0.6
        ],
        "visualOffset": [
          0,
          0
        ],
        "depthMode": "world-sorted",
        "depthBand": "ground-decals"
      }
    }
  ],
  "instances": [],
  "subresources": [
    {
      "version": 1,
      "resourceId": "interior-mushroom-floor-stepping-stone-6.sprite",
      "kind": "sprite-sheet",
      "assetId": "sheet.interiors.mushroom-floor-decor.8x8",
      "frameWidth": 128,
      "frameHeight": 128
    }
  ]
}
