{
  "version": 1,
  "sceneId": "object.interior-seating-chair-heart-s",
  "rootNodeId": "body",
  "nodes": [
    {
      "id": "body",
      "name": "chair-heart-s",
      "type": "StaticBody2D",
      "parentId": null,
      "order": 0,
      "properties": {
        "collisionLayer": 1,
        "collisionMask": 0,
        "position": [
          0,
          0
        ]
      }
    },
    {
      "id": "body-shape",
      "name": "BodyShape",
      "type": "CollisionShape2D",
      "parentId": "body",
      "order": 0,
      "properties": {
        "shape": {
          "resourceId": "interior-seating-chair-heart-s.shape"
        },
        "position": [
          0,
          -19.2225
        ]
      }
    },
    {
      "id": "visual",
      "name": "Visual",
      "type": "Sprite2D",
      "parentId": "body",
      "order": 1,
      "properties": {
        "texture": {
          "resourceId": "interior-seating-chair-heart-s.sprite"
        },
        "frame": 4,
        "origin": [
          0.5,
          1
        ],
        "scale": [
          0.75,
          0.75
        ],
        "visualOffset": [
          0,
          0
        ],
        "depthMode": "world-sorted",
        "depthBand": "world-entities"
      }
    }
  ],
  "instances": [],
  "subresources": [
    {
      "version": 1,
      "resourceId": "interior-seating-chair-heart-s.sprite",
      "kind": "sprite-sheet",
      "assetId": "sheet.interiors.seating-directional.8x8",
      "frameWidth": 128,
      "frameHeight": 128
    },
    {
      "version": 1,
      "resourceId": "interior-seating-chair-heart-s.shape",
      "kind": "collision-shape",
      "value": {
        "shape": "rectangle",
        "width": 47.52,
        "height": 32.445
      }
    }
  ]
}
