{
  "version": 1,
  "sceneId": "object.interior-kitchen-firepit-roaring",
  "rootNodeId": "body",
  "nodes": [
    {
      "id": "body",
      "name": "firepit-roaring",
      "type": "StaticBody2D",
      "parentId": null,
      "order": 0,
      "properties": {
        "collisionLayer": 1,
        "collisionMask": 0,
        "position": [
          0,
          0
        ]
      }
    },
    {
      "id": "body-shape",
      "name": "BodyShape",
      "type": "CollisionShape2D",
      "parentId": "body",
      "order": 0,
      "properties": {
        "shape": {
          "resourceId": "interior-kitchen-firepit-roaring.shape"
        },
        "position": [
          0,
          -14.792
        ]
      }
    },
    {
      "id": "visual",
      "name": "Visual",
      "type": "Sprite2D",
      "parentId": "body",
      "order": 1,
      "properties": {
        "texture": {
          "resourceId": "interior-kitchen-firepit-roaring.sprite"
        },
        "frame": 12,
        "origin": [
          0.5,
          1
        ],
        "scale": [
          0.8,
          0.8
        ],
        "visualOffset": [
          0,
          0
        ],
        "depthMode": "world-sorted",
        "depthBand": "world-entities"
      }
    }
  ],
  "instances": [],
  "subresources": [
    {
      "version": 1,
      "resourceId": "interior-kitchen-firepit-roaring.sprite",
      "kind": "sprite-sheet",
      "assetId": "sheet.interiors.kitchen-hearth.8x8",
      "frameWidth": 128,
      "frameHeight": 128
    },
    {
      "version": 1,
      "resourceId": "interior-kitchen-firepit-roaring.shape",
      "kind": "collision-shape",
      "value": {
        "shape": "rectangle",
        "width": 56.32,
        "height": 23.184
      }
    }
  ]
}
