{
  "version": 1,
  "sceneId": "object.interior-mushroom-furniture-chair-root-e",
  "rootNodeId": "body",
  "nodes": [
    {
      "id": "body",
      "name": "chair-root-e",
      "type": "StaticBody2D",
      "parentId": null,
      "order": 0,
      "properties": {
        "collisionLayer": 1,
        "collisionMask": 0,
        "position": [
          0,
          0
        ]
      }
    },
    {
      "id": "body-shape",
      "name": "BodyShape",
      "type": "CollisionShape2D",
      "parentId": "body",
      "order": 0,
      "properties": {
        "shape": {
          "resourceId": "interior-mushroom-furniture-chair-root-e.shape"
        },
        "position": [
          -0.275,
          -20.3335
        ]
      }
    },
    {
      "id": "visual",
      "name": "Visual",
      "type": "Sprite2D",
      "parentId": "body",
      "order": 1,
      "properties": {
        "texture": {
          "resourceId": "interior-mushroom-furniture-chair-root-e.sprite"
        },
        "frame": 7,
        "origin": [
          0.5,
          1
        ],
        "scale": [
          0.55,
          0.55
        ],
        "visualOffset": [
          0,
          0
        ],
        "depthMode": "world-sorted",
        "depthBand": "world-entities"
      }
    }
  ],
  "instances": [],
  "subresources": [
    {
      "version": 1,
      "resourceId": "interior-mushroom-furniture-chair-root-e.sprite",
      "kind": "sprite-sheet",
      "assetId": "sheet.interiors.mushroom-furniture-props.8x8",
      "frameWidth": 192,
      "frameHeight": 192
    },
    {
      "version": 1,
      "resourceId": "interior-mushroom-furniture-chair-root-e.shape",
      "kind": "collision-shape",
      "value": {
        "shape": "rectangle",
        "width": 58.564,
        "height": 36.267
      }
    }
  ]
}
