{
  "version": 1,
  "sceneId": "object.tree-world-solid.pine-07",
  "rootNodeId": "body",
  "nodes": [
    {
      "id": "body",
      "name": "pine-07",
      "type": "StaticBody2D",
      "parentId": null,
      "order": 0,
      "properties": {
        "collisionLayer": 1,
        "collisionMask": 0,
        "position": [
          0,
          0
        ]
      }
    },
    {
      "id": "body-shape",
      "name": "BodyShape",
      "type": "CollisionShape2D",
      "parentId": "body",
      "order": 0,
      "properties": {
        "shape": {
          "resourceId": "tree-world-solid.pine-07.shape"
        },
        "position": [
          0,
          -20
        ]
      }
    },
    {
      "id": "visual",
      "name": "Visual",
      "type": "Sprite2D",
      "parentId": "body",
      "order": 1,
      "properties": {
        "texture": {
          "resourceId": "tree-world-solid.pine-07.sprite"
        },
        "frame": 23,
        "origin": [
          0.5,
          1
        ],
        "scale": [
          1,
          1
        ],
        "visualOffset": [
          0,
          0
        ],
        "depthMode": "world-sorted",
        "depthBand": "world-entities",
        "occlusionBounds": {
          "width": 112,
          "height": 148,
          "offsetX": 8,
          "offsetY": 12
        }
      }
    },
    {
      "id": "damage-area",
      "name": "DamageArea",
      "type": "Area2D",
      "parentId": "body",
      "order": 2,
      "properties": {
        "collisionLayer": 8,
        "collisionMask": 16,
        "monitoring": false,
        "monitorable": true
      }
    },
    {
      "id": "damage-shape",
      "name": "DamageShape",
      "type": "CollisionShape2D",
      "parentId": "damage-area",
      "order": 0,
      "properties": {
        "shape": {
          "resourceId": "tree-world-solid.pine-07.shape"
        },
        "position": [
          0,
          -20
        ]
      }
    },
    {
      "id": "script",
      "name": "ResourceNodeScript",
      "type": "ScriptNode",
      "scriptId": "game.resource-node",
      "parentId": "body",
      "order": 3,
      "properties": {
        "mapId": "map-template",
        "instanceId": "resource-template",
        "objectId": "tree.world.solid",
        "damageArea": {
          "nodeId": "damage-area"
        },
        "maxHealth": 40,
        "tags": [
          "wood",
          "resource",
          "tree",
          "solid"
        ],
        "drop": {
          "objectId": "collectible.wood-pile",
          "visualId": "wood-pile",
          "pieces": 1
        },
        "hitEffectId": "wood-impact",
        "onHitAnimationId": "",
        "persistHealth": true,
        "depletionMessage": "Tree felled",
        "harvestRequirement": {
          "targetTag": "wood",
          "minimumTier": 1,
          "failureMessage": "Requires an Axe"
        },
        "damageRule": {
          "priority": 0,
          "damageMultiplier": 1
        }
      }
    }
  ],
  "instances": [],
  "subresources": [
    {
      "version": 1,
      "resourceId": "tree-world-solid.pine-07.sprite",
      "kind": "sprite-sheet",
      "assetId": "sheet.trees.8x6",
      "frameWidth": 128,
      "frameHeight": 170
    },
    {
      "version": 1,
      "resourceId": "tree-world-solid.pine-07.shape",
      "kind": "collision-shape",
      "value": {
        "shape": "rectangle",
        "width": 36,
        "height": 34
      }
    }
  ]
}
