{
  "version": 1,
  "sceneId": "object.interior-mushroom-decor-petals-scattered",
  "rootNodeId": "root",
  "nodes": [
    {
      "id": "root",
      "name": "petals-scattered",
      "type": "Node2D",
      "parentId": null,
      "order": 0,
      "properties": {
        "position": [
          0,
          0
        ]
      }
    },
    {
      "id": "visual",
      "name": "Visual",
      "type": "Sprite2D",
      "parentId": "root",
      "order": 0,
      "properties": {
        "texture": {
          "resourceId": "interior-mushroom-decor-petals-scattered.sprite"
        },
        "frame": 46,
        "origin": [
          0.5,
          1
        ],
        "scale": [
          0.8,
          0.8
        ],
        "visualOffset": [
          0,
          0
        ],
        "depthMode": "world-sorted",
        "depthBand": "ground-decals"
      }
    }
  ],
  "instances": [],
  "subresources": [
    {
      "version": 1,
      "resourceId": "interior-mushroom-decor-petals-scattered.sprite",
      "kind": "sprite-sheet",
      "assetId": "sheet.interiors.mushroom-decor-lighting.8x8",
      "frameWidth": 192,
      "frameHeight": 192
    }
  ]
}
