{
  "version": 1,
  "sceneId": "object.interior-mushroom-shell-cell-r2-c7",
  "rootNodeId": "body",
  "nodes": [
    {
      "id": "body",
      "name": "cell-r2-c7",
      "type": "StaticBody2D",
      "parentId": null,
      "order": 0,
      "properties": {
        "collisionLayer": 1,
        "collisionMask": 0,
        "position": [
          0,
          0
        ]
      }
    },
    {
      "id": "body-shape",
      "name": "BodyShape",
      "type": "CollisionShape2D",
      "parentId": "body",
      "order": 0,
      "properties": {
        "shape": {
          "resourceId": "interior-mushroom-shell-cell-r2-c7.shape"
        },
        "position": [
          0,
          -64
        ]
      }
    },
    {
      "id": "visual",
      "name": "Visual",
      "type": "Sprite2D",
      "parentId": "body",
      "order": 1,
      "properties": {
        "texture": {
          "resourceId": "interior-mushroom-shell-cell-r2-c7.sprite"
        },
        "frame": 23,
        "origin": [
          0.5,
          1
        ],
        "scale": [
          1,
          1
        ],
        "visualOffset": [
          0,
          0
        ],
        "depthMode": "world-sorted",
        "depthBand": "ground-decals"
      }
    }
  ],
  "instances": [],
  "subresources": [
    {
      "version": 1,
      "resourceId": "interior-mushroom-shell-cell-r2-c7.sprite",
      "kind": "sprite-sheet",
      "assetId": "sheet.interiors.mushroom-room-shell.8x7",
      "frameWidth": 128,
      "frameHeight": 128
    },
    {
      "version": 1,
      "resourceId": "interior-mushroom-shell-cell-r2-c7.shape",
      "kind": "collision-shape",
      "value": {
        "shape": "rectangle",
        "width": 128,
        "height": 128
      }
    }
  ]
}
