{
  "version": 1,
  "sceneId": "object.wall-stone-solid.horizontal-06",
  "rootNodeId": "body",
  "nodes": [
    {
      "id": "body",
      "name": "horizontal-06",
      "type": "StaticBody2D",
      "parentId": null,
      "order": 0,
      "properties": {
        "collisionLayer": 1,
        "collisionMask": 2,
        "position": [
          0,
          0
        ]
      }
    },
    {
      "id": "body-shape",
      "name": "BodyShape",
      "type": "CollisionShape2D",
      "parentId": "body",
      "order": 0,
      "properties": {
        "shape": {
          "resourceId": "wall-stone-solid.horizontal-06.shape"
        },
        "position": [
          0,
          7
        ]
      }
    },
    {
      "id": "visual",
      "name": "Visual",
      "type": "Sprite2D",
      "parentId": "body",
      "order": 1,
      "properties": {
        "texture": {
          "resourceId": "wall-stone-solid.horizontal-06.sprite"
        },
        "frame": 5,
        "origin": [
          0.5,
          1
        ],
        "scale": [
          1,
          1
        ],
        "visualOffset": [
          0,
          0
        ],
        "depthMode": "world-sorted",
        "depthBand": "world-entities",
        "occlusionBounds": {
          "width": 70,
          "height": 70,
          "offsetX": 0,
          "offsetY": 0
        }
      }
    }
  ],
  "instances": [],
  "subresources": [
    {
      "version": 1,
      "resourceId": "wall-stone-solid.horizontal-06.sprite",
      "kind": "sprite-sheet",
      "assetId": "sheet.walls.horizontal.8x1",
      "frameWidth": 70,
      "frameHeight": 70
    },
    {
      "version": 1,
      "resourceId": "wall-stone-solid.horizontal-06.shape",
      "kind": "collision-shape",
      "value": {
        "shape": "rectangle",
        "width": 70,
        "height": 58
      }
    }
  ]
}
