{
  "version": 1,
  "sceneId": "object.collectible-weaver-fang",
  "rootNodeId": "root",
  "nodes": [
    {
      "id": "root",
      "name": "Weaver fang",
      "type": "Node2D",
      "parentId": null,
      "order": 0,
      "properties": {
        "position": [
          0,
          0
        ]
      }
    },
    {
      "id": "visual",
      "name": "Visual",
      "type": "Sprite2D",
      "parentId": "root",
      "order": 0,
      "properties": {
        "texture": {
          "resourceId": "collectible-weaver-fang.weaver-fang.sprite"
        },
        "frame": 0,
        "origin": [
          0.5,
          0.5
        ],
        "scale": [
          0.5,
          0.5
        ],
        "visualOffset": [
          0,
          0
        ],
        "depthMode": "world-sorted",
        "depthBand": "world-entities"
      }
    },
    {
      "id": "pickup-area",
      "name": "PickupArea",
      "type": "Area2D",
      "parentId": "root",
      "order": 1,
      "properties": {
        "collisionLayer": 64,
        "collisionMask": 32,
        "monitoring": false,
        "monitorable": true
      }
    },
    {
      "id": "pickup-shape",
      "name": "PickupShape",
      "type": "CollisionShape2D",
      "parentId": "pickup-area",
      "order": 0,
      "properties": {
        "shape": {
          "resourceId": "collectible-weaver-fang.weaver-fang.pickup-shape"
        },
        "position": [
          0,
          0
        ]
      }
    },
    {
      "id": "script",
      "name": "CollectibleScript",
      "type": "ScriptNode",
      "scriptId": "game.collectible",
      "parentId": "root",
      "order": 2,
      "properties": {
        "mapId": "map-template",
        "instanceId": "collectible-template",
        "objectId": "collectible.weaver-fang",
        "itemId": "weaver-fang",
        "quantity": 1,
        "pickupArea": {
          "nodeId": "pickup-area"
        }
      }
    },
    {
      "id": "sfx-pickup-sfx",
      "name": "PickupSfx",
      "type": "AudioStreamPlayer2D",
      "parentId": "root",
      "order": 3,
      "properties": {
        "stream": {
          "resourceId": "sfx.pickup.ore"
        },
        "pitchRandomness": 0.06,
        "detached": true,
        "payloadFilter": "status=collected|partial"
      }
    },
    {
      "id": "sfx-inventory-full-sfx",
      "name": "InventoryFullSfx",
      "type": "AudioStreamPlayer2D",
      "parentId": "root",
      "order": 4,
      "properties": {
        "stream": {
          "resourceId": "sfx.pickup.inventory-full"
        },
        "minIntervalMs": 600,
        "payloadFilter": "status=rejected"
      }
    }
  ],
  "instances": [],
  "subresources": [
    {
      "version": 1,
      "resourceId": "collectible-weaver-fang.weaver-fang.sprite",
      "kind": "sprite-sheet",
      "assetId": "sheet.items.chapter-2.5x2",
      "frameWidth": 64,
      "frameHeight": 64,
      "frameCount": 5
    },
    {
      "version": 1,
      "resourceId": "collectible-weaver-fang.weaver-fang.pickup-shape",
      "kind": "collision-shape",
      "value": {
        "shape": "circle",
        "radius": 12
      }
    },
    {
      "version": 1,
      "resourceId": "sfx.pickup.ore",
      "kind": "audio",
      "assetId": "audio.sfx.pickup.ore.1"
    },
    {
      "version": 1,
      "resourceId": "sfx.pickup.inventory-full",
      "kind": "audio",
      "assetId": "audio.sfx.pickup.inventory-full.1"
    }
  ],
  "connections": [
    {
      "source": {
        "nodeId": "script"
      },
      "signal": "pickup_resolved",
      "target": {
        "nodeId": "sfx-pickup-sfx"
      },
      "handler": "play"
    },
    {
      "source": {
        "nodeId": "script"
      },
      "signal": "pickup_resolved",
      "target": {
        "nodeId": "sfx-inventory-full-sfx"
      },
      "handler": "play"
    }
  ]
}
